{
  "$schema": "../../schemas/environment-manifest.schema.json",
  "schema_version": "1.0.0",
  "id": "ENV-0006",
  "hms_version": "GP29 0.1.0 and Runtime core 0.0.1",
  "engine": "CPython 3.12.10 core; PyInstaller 6.22.0 Windows bundler",
  "operating_system": "Windows 10 Pro 22H2 x64 authoritative package build and local qualification; independent qualification on GitHub-hosted Windows runners",
  "architecture": "Windows x64 standalone executables; architecture-independent Python source",
  "dependencies": [
    {
      "name": "PyInstaller",
      "version": "6.22.0",
      "hash": "sha256:be3e2c617a15c6263b4c0f70acb47792fde84d455139e1bc44f9fd4f1548c3a1"
    }
  ],
  "encoding": "UTF-8",
  "alphabet_mapping": "Frozen 29-rune GP29 table in hms_tools/gp29.py; first 29 primes from 2 through 109",
  "page_numbering": "Not applicable",
  "corpus_manifest_id": null,
  "random_seed": null,
  "container_or_lock_hash": "sha256:be3e2c617a15c6263b4c0f70acb47792fde84d455139e1bc44f9fd4f1548c3a1"
}
