{
  "$schema": "../../schemas/environment-manifest.schema.json",
  "schema_version": "1.0.0",
  "id": "ENV-0004",
  "hms_version": "GP29 and Runtime core 0.0.1 internal slice",
  "engine": "CPython 3.12; Python standard library only",
  "operating_system": "Cross-platform source; qualified on Windows 11 and GitHub Actions Ubuntu",
  "architecture": "Architecture-independent Python source",
  "dependencies": [],
  "encoding": "UTF-8",
  "alphabet_mapping": "Frozen 29-rune GP29 table in hms_tools/gp29.py; first 29 primes from 2 through 109",
  "page_numbering": "Not applicable",
  "corpus_manifest_id": null,
  "random_seed": null,
  "container_or_lock_hash": null
}
