{
  "$schema": "../../schemas/environment-manifest.schema.json",
  "schema_version": "1.0.0",
  "id": "ENV-0002",
  "hms_version": "post-v0.1.0 public-run qualification",
  "engine": "CPython 3.12.10; GnuPG 2.5.18 where required",
  "operating_system": "Windows 11",
  "architecture": "x86_64",
  "dependencies": [],
  "encoding": "UTF-8",
  "alphabet_mapping": "Not applicable; synthetic verifier vectors use normalized ASCII",
  "page_numbering": "Not applicable",
  "corpus_manifest_id": null,
  "random_seed": null,
  "container_or_lock_hash": null
}
